{
  "$schema": "https://json-schema.org/draft/2020-12/schema",
  "$id": "https://github.com/ozooma10/osf-ui/blob/main/docs/schema/settings-schema.schema.json",
  "title": "OSF UI Settings Schema",
  "description": "Schema for settings/<modId>.json files. Bridge protocol 2.0.",
  "type": "object",
  "properties": {
    "$schema": {
      "type": "string",
      "description": "Optional editor hint; ignored by the OSF UI runtime."
    },
    "id": {
      "type": "string",
      "pattern": "^(?:osfui|(?![oO][sS][fF][uU][iI]$)(?!.*[<>:\"/\\\\|?*#%\\x00-\\x1F])(?!.*[. ]$)(?!\\.{1,2}$)(?!(?:[cC][oO][nN]|[pP][rR][nN]|[aA][uU][xX]|[nN][uU][lL]|[cC][oO][mM][1-9]|[lL][pP][tT][1-9])(?:\\.|$)).+)$",
      "maxLength": 64,
      "description": "Opaque mod id. Dots have no special meaning. Must be a non-empty Windows filename and URL-path component of at most 64 UTF-8 bytes and equal the filename stem; osfui is reserved for the platform."
    },
    "title": {
      "type": "string",
      "description": "English card header shown in Mod Settings. Defaults to id. Translation catalogs override it at settings.title; authors do not write localization keys."
    },
    "description": {
      "type": "string",
      "description": "Optional English one-line blurb. Translation catalogs override it at settings.description."
    },
    "version": {
      "type": "integer",
      "minimum": 0,
      "description": "Optional schema version (default 0). New mods should declare \"version\": 1."
    },
    "targetVersion": {
      "type": "string",
      "pattern": "^[0-9]+(\\.[0-9]+){0,2}$",
      "description": "The OSF UI release version this schema was authored against (e.g. \"2.0.0\") - the same advisory field as a view manifest's. A target NEWER than the running OSF UI release badges 'needs update' in Mod Settings. A target BELOW 2.0 has no helper-shape effect because a settings schema executes nothing. Declare the release that first shipped whatever you rely on (tabbed `pages`, `onPress`, ...) so an older OSF UI release tells the player to update instead of silently degrading — an unrecognized base type renders read-only at the schema default, and an unrecognized `pages` list collapses into the plain group column."
    },
    "accent": {
      "type": "string",
      "pattern": "^#([0-9a-fA-F]{6}|[0-9a-fA-F]{8})$",
      "description": "Optional per-mod accent colour (#rrggbb or #rrggbbaa). Tints the mod's detail pane."
    },
    "icon": {
      "type": "string",
      "description": "Optional badge image, shown in the Mod Settings rail and inside the Home launcher cards of this mod's views, in place of the title-initials monogram. A path inside the mod's own views namespace folder (views/<modId>/...), with the same sandbox rules as image rows' `src`: no '..', no absolute paths, no URL schemes, no percent-encoding. SVG or PNG; drawn at ~30-52px square (`object-fit: contain`)."
    },
    "presets": {
      "type": "array",
      "description": "Author-shipped value sets applied as a batch of settings. Partial value maps are fine - unlisted keys are left untouched.",
      "items": {
        "type": "object",
        "required": ["label", "values"],
        "properties": {
          "id": { "type": "string", "minLength": 1, "description": "Optional stable localization identity. Without it, the preset array index is used." },
          "label": { "type": "string", "description": "English preset button label; localized at presets.<id>.label." },
          "description": { "type": "string", "description": "Optional English tooltip; localized at presets.<id>.description." },
          "values": {
            "type": "object",
            "description": "key -> value map applied when the preset is chosen. Each value is validated/clamped natively like any settings.set.",
            "additionalProperties": true
          }
        }
      }
    },
    "inputContexts": {
      "type": "array",
      "description": "Authored hotkey contexts local to this mod. These are distinct from Starfield's live engine input contexts. Referenced by key settings through inputContext. The implicit id gameplay is reserved and cannot be redefined.",
      "items": { "$ref": "#/$defs/inputContext" }
    },
    "pages": {
      "type": "array",
      "description": "Optional tabs for the mod's page in Mod Settings. Groups opt in via their `page` field; groups naming no (or an unknown) page collect on an implicit General tab painted first, and an unreferenced page renders no tab. Tabs engage only when they split content across at least two non-empty pages. Display-only annotation on the flat groups list - older OSF UI releases that predate pages render the plain group column unchanged.",
      "items": {
        "type": "object",
        "required": ["id"],
        "properties": {
          "id": {
            "type": "string",
            "minLength": 1,
            "maxLength": 64,
            "pattern": "^[A-Za-z0-9][A-Za-z0-9._-]{0,63}$",
            "description": "Page id referenced by groups' `page`. Also the localization identity: pages.<id>.label."
          },
          "label": {
            "type": "string",
            "description": "English tab label; defaults to id. Localized at pages.<id>.label."
          }
        }
      }
    },
    "groups": {
      "type": "array",
      "description": "Ordered sections of settings.",
      "items": {
        "type": "object",
        "required": ["settings"],
        "properties": {
          "id": {
            "type": "string",
            "minLength": 1,
            "maxLength": 64,
            "pattern": "^[A-Za-z0-9][A-Za-z0-9._-]{0,63}$",
            "description": "Optional stable localization identity. Without it, the group array index is used."
          },
          "label": {
            "type": "string",
            "description": "Optional English section heading; localized at groups.<id>.label."
          },
          "collapsed": {
            "type": "boolean",
            "description": "Start this group collapsed (display-only)."
          },
          "page": {
            "type": "string",
            "description": "Id of a top-level pages[] entry this group renders under. Missing or unknown ids land the group on the implicit General tab."
          },
          "visibleWhen": {
            "$ref": "#/$defs/condition",
            "description": "Show the whole group only when this condition holds (display-only)."
          },
          "settings": {
            "type": "array",
            "items": { "$ref": "#/$defs/item" }
          }
        }
      }
    }
  },
  "$defs": {
    "inputContext": {
      "type": "object",
      "required": ["id"],
      "properties": {
        "id": {
          "type": "string",
          "minLength": 1,
          "maxLength": 64,
          "pattern": "^[A-Za-z0-9][A-Za-z0-9._-]{0,63}$",
          "not": { "const": "gameplay" },
          "description": "Context id local to this mod. gameplay is reserved for the implicit default context."
        },
        "label": {
          "type": "string",
          "description": "English context label, such as During OSF scenes. Defaults to id; localized at inputContexts.<id>.label."
        },
        "blocksGameplay": {
          "type": "boolean",
          "default": false,
          "description": "Author assertion that Starfield gameplay bindings cannot fire while this context is active. Game-binding collisions are shown as expected shares; mod-to-mod collisions are still evaluated by gameplayModes overlap."
        },
        "gameplayModes": {
          "type": "array",
          "minItems": 1,
          "uniqueItems": true,
          "items": { "enum": ["onFoot", "ship", "vehicle", "zeroG"] },
          "description": "Stable semantic gameplay modes in which keys using this context dispatch. Missing, invalid, or empty arrays preserve legacy unscoped non-menu dispatch."
        }
      }
    },
    "papyrusHotkeyTarget": {
      "type": "object",
      "required": ["script", "function"],
      "additionalProperties": false,
      "properties": {
        "script": {
          "type": "string",
          "minLength": 1,
          "maxLength": 128,
          "pattern": "^[A-Za-z_][A-Za-z0-9_]*(?::[A-Za-z_][A-Za-z0-9_]*)*$",
          "description": "Papyrus script name (without .pex) containing the GLOBAL callback. Namespace separators are allowed."
        },
        "function": {
          "type": "string",
          "minLength": 1,
          "maxLength": 128,
          "pattern": "^[A-Za-z_][A-Za-z0-9_]*$",
          "description": "GLOBAL function called as Function name(string asModId, string asKey) Global."
        }
      }
    },
    "item": {
      "description": "A row in a group: a value-bearing setting, or a static/action item (note/image/action).",
      "oneOf": [
        { "$ref": "#/$defs/setting" },
        { "$ref": "#/$defs/note" },
        { "$ref": "#/$defs/image" },
        { "$ref": "#/$defs/action" }
      ]
    },
    "setting": {
      "type": "object",
      "required": ["key", "type"],
      "properties": {
        "key": {
          "type": "string",
          "minLength": 1,
          "description": "Stable identifier, unique within the mod. Used as the persisted key, in the settings.set / settings.reset requests, and as the `key` field of the settings.changed and ui.hotkey events. Keep it unchanged after release; changing it creates a new setting identity, so the previous saved value is not applied."
        },
        "label": {
          "type": "string",
          "description": "Control label. Defaults to key; localized at settings.<key>.label."
        },
        "hint": {
          "type": "string",
          "description": "Optional helper text; localized at settings.<key>.hint."
        },
        "type": {
          "enum": ["bool", "int", "float", "enum", "string", "key", "flags"],
          "description": "Control + validation kind. bool = toggle; int/float clamp to [min,max]; enum must be one of options; string truncates to maxLength; key = a rebindable physical key name captured by a press; flags = multi-select over options (value = array of option strings, filtered/deduped natively). Colour is NOT a type: use type:\"string\" + widget:\"color\". A schema using a newer base type should declare the matching schema-level targetVersion so older OSF UI releases show the 'needs update' badge."
        },
        "default": {
          "description": "Initial value, used until the user changes it and on reset. Should match the type. The 'modified' indicator compares the live value against this."
        },
        "min": { "type": "number", "description": "int/float lower bound (inclusive)." },
        "max": { "type": "number", "description": "int/float upper bound (inclusive)." },
        "step": { "type": "number", "description": "Slider/stepper granularity (UI hint)." },
        "maxLength": { "type": "integer", "minimum": 1, "description": "string max length (UI hint; native ceiling is 256 today)." },
        "allowUnbound": { "type": "boolean", "default": false, "description": "key type only: permit \"\" as the deliberate unbound state (default \"\" is then legal). Unbound keys never dispatch hotkeys and never appear in conflicts; the settings UI renders an unbind x next to the capture button." },
        "inputContext": {
          "type": "string",
          "description": "key type only: local inputContexts id. Missing, invalid, or unknown ids fall back to implicit gameplay."
        },
        "onPress": {
          "$ref": "#/$defs/papyrusHotkeyTarget",
          "description": "key type only: immutable schema-owned GLOBAL Papyrus callback queued after the normal hotkey delivery channels. Never persisted in the user values file."
        },
        "options": {
          "type": "array",
          "items": { "type": "string" },
          "description": "Allowed values for an enum or flags setting. An enum's stored value is always one of these strings; a flags value is an array drawn from them (canonicalized to this order)."
        },
        "optionLabels": {
          "type": "array",
          "items": { "type": "string" },
          "description": "Optional labels parallel to options[]. Localized by stable stored value at settings.<key>.options.<option>; the stored value is never translated."
        },
        "widget": {
          "type": "string",
          "enum": ["slider", "stepper", "dropdown", "segmented", "text", "textarea", "color"],
          "description": "Display hint. int/float: slider (default) | stepper. enum: dropdown (default) | segmented. string: text (default) | textarea | color (swatch + #hex, stored as a hex string)."
        },
        "format": {
          "type": "object",
          "description": "int/float display formatting. Store the raw value; show a friendly string. e.g. store 0.0-1.0 with {scale:100,suffix:\"%\",decimals:0} shows \"85%\".",
          "properties": {
            "prefix": { "type": "string", "description": "English display prefix; localized at settings.<key>.format.prefix." },
            "suffix": { "type": "string", "description": "English display suffix; localized at settings.<key>.format.suffix." },
            "scale": { "type": "number", "description": "Multiply the stored value by this for display (default 1)." },
            "decimals": { "type": "integer", "minimum": 0, "maximum": 20, "description": "Fixed decimal places in the display string (0-20; clamped by the renderer)." }
          }
        },
        "requires": {
          "type": "string",
          "enum": ["restart", "reload", "newGame"],
          "description": "Marks that a change to this setting takes effect only after a game restart / overlay reload / new game. Shows a badge and aggregates into a banner."
        },
        "visibleWhen": {
          "$ref": "#/$defs/condition",
          "description": "Show this row only when the condition holds (display-only; a hidden setting is still writable and still validated natively)."
        },
        "enabledWhen": {
          "$ref": "#/$defs/condition",
          "description": "Enable this control only when the condition holds (display-only)."
        }
      },
      "allOf": [
        {
          "if": { "properties": { "type": { "const": "enum" } } },
          "then": { "required": ["options"] }
        },
        {
          "if": { "properties": { "type": { "const": "flags" } } },
          "then": { "required": ["options"] }
        },
        {
          "if": { "required": ["onPress"] },
          "then": { "properties": { "type": { "const": "key" } } }
        }
      ]
    },
    "note": {
      "type": "object",
      "required": ["type", "text"],
      "properties": {
        "type": { "const": "note" },
        "id": { "type": "string", "minLength": 1, "description": "Optional stable localization identity; without it, the item index is used." },
        "text": { "type": "string", "description": "static rich text. Micro-markdown only: **bold**, *italic*, `code`, and \\n line breaks. No HTML or links. Localized at notes.<id>.text." },
        "style": { "enum": ["info", "warn", "danger"], "description": "Callout tone (default info)." },
        "visibleWhen": { "$ref": "#/$defs/condition" }
      }
    },
    "image": {
      "type": "object",
      "required": ["type", "src"],
      "properties": {
        "type": { "const": "image" },
        "id": { "type": "string", "minLength": 1, "description": "Optional stable localization identity; without it, the item index is used." },
        "src": { "type": "string", "description": "Image path relative to the mod namespace folder views/<modId>/. No '..', absolute paths, or URL schemes." },
        "caption": { "type": "string", "description": "Optional English caption; localized at images.<id>.caption." },
        "height": { "type": "integer", "minimum": 1, "description": "Optional fixed display height in px." },
        "visibleWhen": { "$ref": "#/$defs/condition" }
      }
    },
    "action": {
      "type": "object",
      "required": ["type", "key", "label", "command"],
      "properties": {
        "type": { "const": "action" },
        "key": { "type": "string", "minLength": 1, "description": "Row id (not persisted)." },
        "label": { "type": "string", "description": "English button label; localized at actions.<key>.label." },
        "hint": { "type": "string", "description": "Optional English helper text; localized at actions.<key>.hint." },
        "command": {
          "type": "string",
          "description": "Compatibility field containing the bridge REQUEST endpoint name fired on click. It MUST be namespaced with the mod id (\"<id>.something\"); Mod Settings refuses any other name, and refuses a leading segment from a framework namespace (ui, menu, hud, settings, views, game, runtime) even if a schema claims one as its id. Register it as a request endpoint, NOT a send endpoint — a button needs an outcome, and that is exactly what separates the two endpoint kinds; registering the name as a send instead makes the card's request come back `wrong-endpoint-kind` and the button report a failure. Native plugins use RegisterRequest. Papyrus registers the local portion with OSFUI_View.RegisterRequest; owning views use that local name and cross-view callers use the qualified command. Settle it exactly once: native handlers may Respond with `{ message: string }` or `{}`; Papyrus may Reply with a string message or None. Reject with a stable code and sentence for an error toast. The button sends { mod, key } and waits 5s; a handler that never settles rejects with `timeout`, which Mod Settings renders as 'No response from <mod>'."
        },
        "style": { "enum": ["default", "accent", "danger"], "description": "Button tone (default 'default')." },
        "confirm": { "type": "string", "description": "English inline confirmation message; localized at actions.<key>.confirm." },
        "enabledWhen": { "$ref": "#/$defs/condition" },
        "visibleWhen": { "$ref": "#/$defs/condition" }
      }
    },
    "condition": {
      "description": "Display-only predicate over sibling setting values in the same mod. A leaf references one key with exactly one operator; combinators nest. A reference to an unknown key evaluates false.",
      "type": "object",
      "oneOf": [
        {
          "required": ["all"],
          "properties": { "all": { "type": "array", "items": { "$ref": "#/$defs/condition" } } },
          "additionalProperties": false
        },
        {
          "required": ["any"],
          "properties": { "any": { "type": "array", "items": { "$ref": "#/$defs/condition" } } },
          "additionalProperties": false
        },
        {
          "required": ["not"],
          "properties": { "not": { "$ref": "#/$defs/condition" } },
          "additionalProperties": false
        },
        {
          "required": ["key"],
          "properties": {
            "key": { "type": "string", "description": "Sibling setting key to test." },
            "eq": { "description": "value === key's value" },
            "ne": { "description": "value !== key's value" },
            "in": { "type": "array", "description": "key's value is one of these" },
            "gt": { "type": "number" },
            "gte": { "type": "number" },
            "lt": { "type": "number" },
            "lte": { "type": "number" },
            "truthy": { "type": "boolean", "description": "true: key's value is truthy; false: falsy" }
          },
          "additionalProperties": false
        }
      ]
    }
  }
}
