{
  "$schema": "https://raw.githubusercontent.com/ozooma10/osf-ui/refs/heads/main/docs/schema/settings-schema.schema.json",
  "id": "osfui",
  "title": "OSF UI",
  "description": "OSF UI behavior and overlay presentation.",
  "version": 1,
  "groups": [
    {
		  "id": "input",
      "label": "Input",
      "settings": [
        {
          "key": "toggleKey",
          "label": "Open / Close key",
          "type": "key",
          "default": "F10",
          "hint": "Press to rebind the key that opens and closes the overlay."
        }
      ]
    },
    {
		"id": "interface",
      "label": "Interface",
      "settings": [
        {
          "key": "language",
          "label": "Language",
          "type": "string",
          "default": "auto",
          "maxLength": 32,
          "hint": "Use auto for Starfield's language, or enter a locale such as en, de, or pt-BR."
        },
        {
          "key": "highRefreshCapture",
          "label": "240 Hz focused capture",
          "type": "bool",
          "default": false,
          "requires": "restart",
          "hint": "Allow focused menus to request capture at up to 240 Hz. May increase GPU use."
        }
      ]
    },
    {
      "id": "developer",
      "label": "Developer",
      "collapsed": true,
      "settings": [
        {
          "key": "developerMode",
          "label": "Developer mode",
          "type": "bool",
          "default": false,
          "requires": "restart",
          "hint": "Enable verbose diagnostics, F12 WebView DevTools, schema and loose-view hot reload, and developer-only views on the next launch. Security and validation rules remain unchanged."
        }
      ]
    }
  ]
}
