{
  "$schema": "https://github.com/ozooma10/osf-ui/blob/main/docs/schema/settings-schema.schema.json",
  "id": "osfui.hotkey-sample",
  "title": "Declarative Hotkey Sample",
  "description": "Tests schema-owned GLOBAL Papyrus dispatch without a startup quest or callback registration.",
  "version": 1,
  "groups": [
    {
      "id": "hotkeys",
      "label": "Hotkeys",
      "settings": [
        {
          "key": "showNotification",
          "label": "Show test notification",
          "hint": "Close all menus and press this key. The callback remains active after loading a save without re-registration.",
          "type": "key",
          "default": "F8",
          "onPress": {
            "script": "OSFUIHotkeySample",
            "function": "OnHotkey"
          }
        }
      ]
    }
  ]
}
